training/results/spatial/hierarchical_custom_ensemble_rf_stacking_spatial_breast_coarse/combined_result.csv

Distribution,In-Distribution,In-Distribution,In-Distribution,In-Distribution,In-Distribution,In-Distribution,In-Distribution,In-Distribution,In-Distribution,In-Distribution,In-Distribution,In-Distribution,In-Distribution,In-Distribution,In-Distribution,In-Distribution,In-Distribution,In-Distribution,In-Distribution,In-Distribution,In-Distribution,In-Distribution,In-Distribution,In-Distribution,In-Distribution,In-Distribution,In-Distribution,In-Distribution,In-Distribution,In-Distribution,In-Distribution,In-Distribution,In-Distribution,In-Distribution,In-Distribution,In-Distribution,In-Distribution,In-Distribution,In-Distribution,In-Distribution,In-Distribution,In-Distribution,In-Distribution,In-Distribution,In-Distribution,In-Distribution,In-Distribution,In-Distribution,In-Distribution,In-Distribution,In-Distribution,In-Distribution,In-Distribution,In-Distribution,In-Distribution,In-Distribution,All,All,All,All
Category,Baseline,Baseline,Baseline,Classification Report,Classification Report,Classification Report,Classification Report,Classification Report,Classification Report,Classification Report,Classification Report,Classification Report,Classification Report,Classification Report,Classification Report,Classification Report,Classification Report,Classification Report,Classification Report,Classification Report,Classification Report,Classification Report,Classification Report,Classification Report,Classification Report,Classification Report,Classification Report,Classification Report,Classification Report,Classification Report,Classification Report,Classification Report,Classification Report,Classification Report,Classification Report,Classification Report,Classification Report,Classification Report,Classification Report,Classification Report,Classification Report,Classification Report,Classification Report,Classification Report,Dropout,Dropout,Consistency,Consistency,Dropout,Dropout,Dropout,Dropout,Dropout,Dropout,Dropout,Dropout,Technical_Metrics,Technical_Metrics,Technical_Metrics,Technical_Metrics
Sub-Category,Overall,Batch Effect,Batch Effect,B cell,B cell,B cell,B cell,Endothelial cell,Endothelial cell,Endothelial cell,Endothelial cell,Epithelial cell,Epithelial cell,Epithelial cell,Epithelial cell,Myeloid cell,Myeloid cell,Myeloid cell,Myeloid cell,Natural killer cell,Natural killer cell,Natural killer cell,Natural killer cell,Plasma cell,Plasma cell,Plasma cell,Plasma cell,Stromal cell,Stromal cell,Stromal cell,Stromal cell,T cell,T cell,T cell,T cell,Total_Accuracy,macro avg,macro avg,macro avg,macro avg,weighted avg,weighted avg,weighted avg,weighted avg,Random,Random,Num Samples,Inconsistent Predictions,FI_0.1%,FI_0.1%,FI_0.5%,FI_0.5%,FI_1.0%,FI_1.0%,FI_2.0%,FI_2.0%,Resource_Usage,Resource_Usage,Resource_Usage,Resource_Usage
Metric,Accuracy,Macro_F1_Mean,Macro_F1_Std,precision,recall,f1-score,support,precision,recall,f1-score,support,precision,recall,f1-score,support,precision,recall,f1-score,support,precision,recall,f1-score,support,precision,recall,f1-score,support,precision,recall,f1-score,support,precision,recall,f1-score,support,accuracy,precision,recall,f1-score,support,precision,recall,f1-score,support,Accuracy,Macro_F1,Count,Count,Accuracy,Macro_F1,Accuracy,Macro_F1,Accuracy,Macro_F1,Accuracy,Macro_F1,Training_Time_Min,Inference_Evaluation_Time_Min,Total_Pipeline_Time_Min,Peak_RAM_GB
0,0.8933809543936768,0.8163002205932168,0.04938933135365424,0.9016841147018662,0.6533641160949868,0.7576974564926372,3032.0,0.9768160741885626,0.9349112426035503,0.9554043839758125,1352.0,0.9189012426422498,0.9440089585666294,0.9312859036676977,13395.0,0.9812055309437508,0.9317950025497195,0.9558621591577846,7844.0,0.7095652173913043,0.23076923076923078,0.34827144686299616,1768.0,0.9448621553884712,0.7623862487360971,0.8438724118634583,989.0,0.984241083771081,0.9734755263877495,0.9788287049766291,3657.0,0.8142054802291938,0.9392055493750409,0.872249908836757,15281.0,0.8933809543936768,0.90393511240706,0.7962394843853755,0.8304340469792215,47318.0,0.8937411441894182,0.8933809543936768,0.8859242579082844,47318.0,0.8862145483748256,0.8138995107558108,47318,0,0.8933386871803543,0.8304021100132415,0.8887315609281881,0.8150700121556775,0.8879073502683968,0.8114160977421849,0.886364596982121,0.8103307669370483,101.5,4.82,106.32,21.965843200683594
0,0.8938247601335644,0.8141239954230388,0.04574891683641096,0.9119555143651529,0.6490765171503958,0.7583815028901734,3032.0,0.9746932515337423,0.9400887573964497,0.9570783132530121,1352.0,0.9238025594149909,0.9431131019036955,0.9333579608422609,13395.0,0.9813547954393025,0.9326874043855176,0.9564023792404732,7844.0,0.6858736059479554,0.208710407239819,0.32003469210754554,1768.0,0.948019801980198,0.7745197168857432,0.8525319977740679,989.0,0.9826158940397351,0.9737489745693191,0.9781623403378656,3657.0,0.8115566569047082,0.943001112492638,0.8723552380664104,15281.0,0.8938247601335644,0.9024840099532232,0.7956182490029473,0.8285380530639761,47318.0,0.8939506406136569,0.8938247601335644,0.8858005050399113,47318.0,0.8877425081364386,0.8163386097251262,47318,0,0.893803626526903,0.8285267628551044,0.8891542330614143,0.8143103317735381,0.8885836256815588,0.8107589174836897,0.8870831396086056,0.8092864862465019,92.98,4.77,97.75,21.965843200683594
0,0.8942896994801133,0.8170122398391774,0.04231975708522511,0.9082147774208352,0.6527044854881267,0.7595471118787182,3032.0,0.9746738296239448,0.9393491124260355,0.9566854990583804,1352.0,0.9178736964078795,0.946173945502053,0.9318089916553322,13395.0,0.9804315775365232,0.932559918408975,0.9558967657628226,7844.0,0.7148014440433214,0.2239819004524887,0.34108527131782945,1768.0,0.9359903381642513,0.7836198179979778,0.8530544854155201,989.0,0.9834208344846642,0.9732020782061799,0.9782847718526663,3657.0,0.8168051918478879,0.9389437864014135,0.873626206350656,15281.0,0.8942896994801133,0.9040264611911635,0.7988168806104062,0.8312486379114906,47318.0,0.894465598846583,0.8942896994801133,0.8865590351977134,47318.0,0.888279301745636,0.8189893362387192,47318,0,0.8943108330867746,0.8312807066695886,0.8896614396212857,0.8154622141295648,0.8891119658480916,0.8125466708634641,0.8875903461684771,0.8117921522004659,104.54,4.8,109.34,21.965843200683594
0,0.8943531003000972,0.8151876178847193,0.04846740990032712,0.903137789904502,0.6550131926121372,0.7593194417893329,3032.0,0.9761354888375674,0.9378698224852071,0.9566201433421351,1352.0,0.9247878255779924,0.9436356849570735,0.9341166906846987,13395.0,0.9827213822894169,0.9280979092299847,0.9546289011277209,7844.0,0.7098540145985401,0.22002262443438914,0.33592400690846286,1768.0,0.9330085261875761,0.7745197168857432,0.8464088397790055,989.0,0.9831816928591122,0.9751162154771671,0.9791323448654585,3657.0,0.8127112914131169,0.9439172829003337,0.8734142723061552,15281.0,0.8943531003000972,0.903192251458478,0.7972740561227545,0.8299455801003712,47318.0,0.8949311558238637,0.8943531003000972,0.8866509915996057,47318.0,0.8883427025656199,0.8226046714523505,47318,0,0.8942896994801133,0.8298922096594861,0.8899150429012215,0.8158241259759409,0.8889428969948011,0.8123666222719946,0.887442410921848,0.810496615192791,94.92,4.82,99.74,21.965843200683594
0,0.8928948814404666,0.8122240473889597,0.04429678470634253,0.9029345372460497,0.6596306068601583,0.7623403849818944,3032.0,0.9777094542659492,0.9408284023668639,0.9589144364869958,1352.0,0.9201976887855222,0.9452034341172079,0.9325329601532003,13395.0,0.9821910415542364,0.9280979092299847,0.9543786051389617,7844.0,0.7070707070707071,0.19796380090497737,0.3093239063190455,1768.0,0.943109987357775,0.7542972699696663,0.8382022471910112,989.0,0.9828823854224186,0.9734755263877495,0.9781563401566149,3657.0,0.8114314732268804,0.9411033309338394,0.8714701248333535,15281.0,0.8928948814404666,0.9034409093661924,0.7925750350963059,0.8256648756576347,47318.0,0.8932464872521807,0.8928948814404666,0.8845515987094309,47318.0,0.8853861109937021,0.8131678720139547,47318,0,0.8928737478338054,0.8256639341006784,0.8880341519083647,0.8104131341175188,0.8873790101018639,0.8069471058473451,0.8858573904222494,0.8049392106936355,96.48,4.79,101.27,21.965843200683594
0,0.8932118855403863,0.8184051245649079,0.04458495392356215,0.8948069241011984,0.6649076517150396,0.7629139072847683,3032.0,0.9762087490406753,0.9408284023668639,0.9581920903954803,1352.0,0.9169017140377522,0.9464725643896976,0.9314525016530747,13395.0,0.9804845222072678,0.9287353391126976,0.9539086028545241,7844.0,0.6762820512820513,0.23868778280542988,0.3528428093645485,1768.0,0.9417596034696406,0.7684529828109201,0.8463251670378619,989.0,0.9829059829059829,0.9748427672955975,0.9788577704557935,3657.0,0.817733707800768,0.9336430861854591,0.8718528477144952,15281.0,0.8932118855403863,0.898385406855667,0.7995713220852132,0.8320432120950683,47318.0,0.8923253467432306,0.8932118855403863,0.8861575705476761,47318.0,0.8855995604209814,0.8192728284053888,47318,0,0.8931273511137411,0.8319664909536031,0.8895769051946405,0.8196658430145098,0.8887104273215267,0.815410350459437,0.887442410921848,0.814712530094365,102.51,4.82,107.32,21.965843200683594
0,0.894205165053468,0.8186421421259533,0.046174940767850066,0.9048702776513428,0.6556728232189973,0.7603748326639893,3032.0,0.9768339768339769,0.9356508875739645,0.9557990177559501,1352.0,0.9229983957999125,0.9449794699514744,0.933859603821609,13395.0,0.9831309041835358,0.9287353391126976,0.9551593024780386,7844.0,0.6996587030716723,0.2319004524886878,0.34834324553950724,1768.0,0.9390243902439024,0.7785642062689585,0.8512990602542841,989.0,0.9831584759801215,0.9737489745693191,0.9784311031735129,3657.0,0.8133416317754895,0.9407106864733983,0.8724017599757244,15281.0,0.894205165053468,0.9028770944424942,0.7987453549571872,0.831958490707827,47318.0,0.8945700214184114,0.894205165053468,0.8868953716063943,47318.0,0.8874128238725222,0.8209165533245357,47318,0,0.8941417642334841,0.8319188735860903,0.8899995773278667,0.8188365466439452,0.8892387674880595,0.8148951797030112,0.8879496174817194,0.8134963927405623,95.25,4.81,100.05,21.965843200683594
0,0.8919016019273849,0.8128131310482224,0.04648423965250901,0.9031963470319635,0.6523746701846965,0.7575641516660283,3032.0,0.9768518518518519,0.9363905325443787,0.9561933534743202,1352.0,0.9124649356254045,0.9470698021649869,0.9294453806139644,13395.0,0.9825863930885529,0.9279704232534421,0.9544977707841594,7844.0,0.6940298507462687,0.21040723981900453,0.3229166666666667,1768.0,0.9438339438339438,0.78159757330637,0.8550884955752213,989.0,0.9815477829798953,0.9745693191140279,0.9780461031833151,3657.0,0.8146564014827488,0.9348210195667823,0.8706118966357874,15281.0,0.8919016019273849,0.9011459383300786,0.7956500724942112,0.8280454773249328,47318.0,0.8915814651502612,0.8919016019273849,0.8838886573762013,47318.0,0.8848408639418401,0.81197779713952,47318,0,0.8918170675007396,0.8279976489806091,0.8871465404285895,0.813956896210047,0.8861955281288305,0.8089962457927422,0.8846527748425547,0.8074750212661916,92.76,4.8,97.56,21.965843200683594
0,0.8947969060399847,0.8199148826218241,0.04594191198402941,0.8964430436740207,0.6566622691292876,0.7580430230344565,3032.0,0.9762633996937213,0.9430473372781065,0.9593679458239278,1352.0,0.9225388034686293,0.9451287793952967,0.9336971753079135,13395.0,0.9817081371889711,0.9305201427842937,0.9554290202238367,7844.0,0.6952380952380952,0.24773755656108598,0.3653044203502919,1768.0,0.9376528117359413,0.775530839231547,0.8489208633093526,989.0,0.9839779005524862,0.9740224227508887,0.9789748522742888,3657.0,0.8168516937090805,0.9389437864014135,0.8736528039943982,15281.0,0.8947969060399847,0.9013342356576182,0.80144914169149,0.8341737630398083,47318.0,0.8946508056649651,0.8947969060399847,0.8878767337604597,47318.0,0.8876283866604675,0.820905720226464,47318,0,0.8947757724333235,0.8341743737754466,0.8905701847077222,0.8211029268610626,0.8895769051946405,0.8161654259248254,0.8882032207616551,0.8148582412379929,103.73,4.82,108.55,21.965843200683594
0,0.8934020880003382,0.817546464476702,0.04987603920206591,0.8985701519213584,0.6632585751978892,0.7631878557874763,3032.0,0.9747126436781609,0.9408284023668639,0.9574708317651487,1352.0,0.9155061692762826,0.9472191116088092,0.931092683642768,13395.0,0.9814590890769851,0.9312850586435492,0.9557140053640348,7844.0,0.6818181818181818,0.23755656108597284,0.3523489932885906,1768.0,0.9514066496163683,0.7522750252780587,0.8402032749858837,989.0,0.983167770419426,0.9742958709324583,0.9787117154237055,3657.0,0.8177754856455217,0.9339048491590864,0.8719907124526457,15281.0,0.8934020880003382,0.9005520176815356,0.797577931784086,0.8313400090887817,47318.0,0.8927324460364406,0.8934020880003382,0.8862387712530773,47318.0,0.887138086985925,0.8156211940183555,47318,0,0.8933598207870155,0.831294509603001,0.8896614396212857,0.8197008675349766,0.8892387674880595,0.8168917806658476,0.8873367428885414,0.8146185837979514,97.7,4.84,102.55,21.965843200683594
mean,0.893626104230948,0.8162169865966721,0.04632842854119765,0.902581347801829,0.6562664907651715,0.7599369668469474,3032.0,0.9760898719548153,0.9389792899408282,0.9571726015331162,1352.0,0.9195973031036617,0.9453004852556924,0.9322649852042518,13395.0,0.9817273373508542,0.9300484446710863,0.9551877512132357,7844.0,0.6974191871208097,0.2247737556561086,0.3396395458725484,1768.0,0.9418668207978067,0.7705763397371083,0.8475906843185668,989.0,0.9831099803414924,0.9740497675690456,0.978558604669985,3657.0,0.8147069014035395,0.9388194489889404,0.8723625771166384,15281.0,0.893626104230948,0.9021373437343512,0.7973517528229978,0.8303392145969111,47318.0,0.893619511173901,0.893626104230948,0.8860543492998755,47318.0,0.8868584893697958,0.8173694093300226,47318.0,0.0,0.8935838370176254,0.8303117620196849,0.8892451075700578,0.8164342898416781,0.8884885244515829,0.8126394396754542,0.886992265099962,0.8112006000407506,98.23700000000001,4.809,103.04499999999999,21.965843200683594
std,0.0008501560785692361,0.0025759709557263387,0.0023640760563769345,0.0051712612216729,0.0049989962396600135,0.0021752157585884883,0.0,0.0010637213883664218,0.0026611234153011555,0.0013125651734288988,0.0,0.003993544590286337,0.0014265152376678595,0.001507032323702196,0.0,0.0009200302956945854,0.0019278551352308227,0.0008060973716126496,0.0,0.013090183751739214,0.015554470038819834,0.017460254670716532,0.0,0.005598668370348896,0.01096755769853826,0.00563272888139472,0.0,0.0007392294212902829,0.0006373943573802827,0.0003888841733947505,0.0,0.0024570440010824772,0.00364207771142356,0.0009798668233724948,0.0,0.0008501560785692361,0.001779463573994269,0.002490335275158049,0.002416996853202498,0.0,0.0011196368438300477,0.0008501560785692361,0.0011408379541273574,0.0,0.0012569611395436048,0.003676112993629361,0.0,0.0,0.0008661169802822038,0.0024146125531672767,0.0010205122783910718,0.0033126349561018484,0.0010429838732936563,0.0032330374991679837,0.0010764110259870805,0.003350226734371892,4.468907522476209,0.019692073983656057,4.4764103922674465,0.0
mean +- std,0.8936 +- 0.0009,0.8162 +- 0.0026,0.0463 +- 0.0024,0.9026 +- 0.0052,0.6563 +- 0.005,0.7599 +- 0.0022,3032.0 +- 0.0,0.9761 +- 0.0011,0.939 +- 0.0027,0.9572 +- 0.0013,1352.0 +- 0.0,0.9196 +- 0.004,0.9453 +- 0.0014,0.9323 +- 0.0015,13395.0 +- 0.0,0.9817 +- 0.0009,0.93 +- 0.0019,0.9552 +- 0.0008,7844.0 +- 0.0,0.6974 +- 0.0131,0.2248 +- 0.0156,0.3396 +- 0.0175,1768.0 +- 0.0,0.9419 +- 0.0056,0.7706 +- 0.011,0.8476 +- 0.0056,989.0 +- 0.0,0.9831 +- 0.0007,0.974 +- 0.0006,0.9786 +- 0.0004,3657.0 +- 0.0,0.8147 +- 0.0025,0.9388 +- 0.0036,0.8724 +- 0.001,15281.0 +- 0.0,0.8936 +- 0.0009,0.9021 +- 0.0018,0.7974 +- 0.0025,0.8303 +- 0.0024,47318.0 +- 0.0,0.8936 +- 0.0011,0.8936 +- 0.0009,0.8861 +- 0.0011,47318.0 +- 0.0,0.8869 +- 0.0013,0.8174 +- 0.0037,47318.0 +- 0.0,0.0 +- 0.0,0.8936 +- 0.0009,0.8303 +- 0.0024,0.8892 +- 0.001,0.8164 +- 0.0033,0.8885 +- 0.001,0.8126 +- 0.0032,0.887 +- 0.0011,0.8112 +- 0.0034,98.237 +- 4.4689,4.809 +- 0.0197,103.045 +- 4.4764,21.9658 +- 0.0

training/results/spatial/hierarchical_custom_ensemble_rf_stacking_spatial_breast_coarse/robustness_report.md

### Further Robustness Evaluation with metric: Accuracy

Random% Random Dropout Accuracy: 0.8869 +- 0.0013
Number of inconsistent predictions: 0.0 +- 0.0
Feature importance dropout (0.1% features dropped) Accuracy score: 0.8936 +- 0.0009
Feature importance dropout (0.5% features dropped) Accuracy score: 0.8892 +- 0.001
Feature importance dropout (1.0% features dropped) Accuracy score: 0.8885 +- 0.001
Feature importance dropout (2.0% features dropped) Accuracy score: 0.887 +- 0.0011

### Further Robustness Evaluation with metric: Macro_F1

Random% Random Dropout Macro_F1: 0.8174 +- 0.0037
Number of inconsistent predictions: 0.0 +- 0.0
Feature importance dropout (0.1% features dropped) Macro_F1 score: 0.8303 +- 0.0024
Feature importance dropout (0.5% features dropped) Macro_F1 score: 0.8164 +- 0.0033
Feature importance dropout (1.0% features dropped) Macro_F1 score: 0.8126 +- 0.0032
Feature importance dropout (2.0% features dropped) Macro_F1 score: 0.8112 +- 0.0034